{
  "$schema": "https://folio.mccal.dev/schema/v1/index.schema.json",
  "format": 1,
  "name": "Folio",
  "description": "Folio’s own themes and tweaks. Built into the app, listed here so the Market treats them like any other package.",
  "icon": "assets/folio-icon.png",
  "issuesUrl": "https://github.com/McCal-Codes/folio/issues/new",
  "featured": [
    {
      "package": "com.mccal.folio.theme.clear",
      "label": "Theme of the week",
      "image": "assets/home-clear.webp"
    },
    {
      "package": "com.mccal.folio.cabinet",
      "label": "Built-in tweak"
    }
  ],
  "packages": [
    {
      "id": "com.mccal.folio.cabinet",
      "version": "1.0.0",
      "manifest": {
        "format": 1,
        "id": "com.mccal.folio.cabinet",
        "name": "Cabinet",
        "version": "1.0.0",
        "author": {
          "name": "Folio",
          "url": "https://github.com/McCal-Codes/folio"
        },
        "minFolio": "0.6.6",
        "section": "tweaks",
        "kind": [
          "tweakBundle"
        ],
        "permissions": [
          "tweaks"
        ],
        "screens": [
          "cover",
          "inner"
        ],
        "icon": "assets/icons/cabinet.png",
        "depiction": "depiction.json",
        "license": "MIT",
        "description": "Swipe up on an app icon for a small panel with its shortcuts, latest notifications and music controls.",
        "requires": {
          "features": [
            "tweaks.appPanels"
          ]
        }
      }
    },
    {
      "id": "com.mccal.folio.harborline",
      "version": "1.0.0",
      "manifest": {
        "format": 1,
        "id": "com.mccal.folio.harborline",
        "name": "Harborline",
        "version": "1.0.0",
        "author": {
          "name": "Folio",
          "url": "https://github.com/McCal-Codes/folio"
        },
        "minFolio": "0.6.6",
        "section": "tweaks",
        "kind": [
          "tweakBundle"
        ],
        "permissions": [
          "tweaks"
        ],
        "screens": [
          "cover",
          "inner"
        ],
        "icon": "assets/icons/harborline.png",
        "depiction": "depiction.json",
        "license": "MIT",
        "description": "Dock icons swell under your finger as you slide along the dock.",
        "requires": {
          "features": [
            "tweaks.dockMagnify"
          ]
        }
      }
    },
    {
      "id": "com.mccal.folio.roll-call",
      "version": "1.0.0",
      "manifest": {
        "format": 1,
        "id": "com.mccal.folio.roll-call",
        "name": "Roll Call",
        "version": "1.0.0",
        "author": {
          "name": "Folio",
          "url": "https://github.com/McCal-Codes/folio"
        },
        "minFolio": "0.6.6",
        "section": "tweaks",
        "kind": [
          "tweakBundle"
        ],
        "permissions": [
          "tweaks"
        ],
        "screens": [
          "cover",
          "inner"
        ],
        "icon": "assets/icons/roll-call.png",
        "depiction": "depiction.json",
        "license": "MIT",
        "description": "A row of app icons above Notification Center. Tap one to show only that app.",
        "requires": {
          "features": [
            "tweaks.notificationAppRow"
          ]
        }
      }
    },
    {
      "id": "com.mccal.folio.palette",
      "version": "1.0.0",
      "manifest": {
        "format": 1,
        "id": "com.mccal.folio.palette",
        "name": "Palette",
        "version": "1.0.0",
        "author": {
          "name": "Folio",
          "url": "https://github.com/McCal-Codes/folio"
        },
        "minFolio": "0.6.6",
        "section": "tweaks",
        "kind": [
          "tweakBundle"
        ],
        "permissions": [
          "tweaks"
        ],
        "screens": [
          "cover",
          "inner"
        ],
        "icon": "assets/icons/palette.png",
        "depiction": "depiction.json",
        "license": "MIT",
        "description": "Notification cards take on a soft version of their app’s color.",
        "requires": {
          "features": [
            "tweaks.tintNotifications"
          ]
        }
      }
    },
    {
      "id": "com.mccal.folio.colored-albums",
      "version": "1.0.0",
      "manifest": {
        "format": 1,
        "id": "com.mccal.folio.colored-albums",
        "name": "Afterglow",
        "version": "1.0.0",
        "author": {
          "name": "Folio",
          "url": "https://github.com/McCal-Codes/folio"
        },
        "minFolio": "0.6.6",
        "section": "tweaks",
        "kind": [
          "tweakBundle"
        ],
        "permissions": [
          "tweaks"
        ],
        "screens": [
          "cover",
          "inner"
        ],
        "icon": "assets/icons/colored-albums.png",
        "depiction": "depiction.json",
        "license": "MIT",
        "description": "The music card and the island’s sound bars take on the album art’s color.",
        "requires": {
          "features": [
            "tweaks.tintMedia"
          ]
        }
      }
    },
    {
      "id": "com.mccal.folio.flipbook",
      "version": "1.0.0",
      "manifest": {
        "format": 1,
        "id": "com.mccal.folio.flipbook",
        "name": "Flipbook",
        "version": "1.0.0",
        "author": {
          "name": "Folio",
          "url": "https://github.com/McCal-Codes/folio"
        },
        "minFolio": "0.6.7",
        "section": "tweaks",
        "kind": [
          "tweakBundle"
        ],
        "permissions": [
          "tweaks"
        ],
        "screens": [
          "cover",
          "inner"
        ],
        "icon": "assets/icons/flipbook.png",
        "depiction": "depiction.json",
        "license": "MIT",
        "description": "Home pages move in 3D as you swipe, instead of sliding flat.",
        "requires": {
          "features": [
            "tweaks.pageEffects"
          ]
        }
      }
    },
    {
      "id": "com.mccal.folio.theme.classic",
      "version": "1.0.0",
      "manifest": {
        "format": 1,
        "id": "com.mccal.folio.theme.classic",
        "name": "Classic theme",
        "version": "1.0.0",
        "author": {
          "name": "Folio",
          "url": "https://github.com/McCal-Codes/folio"
        },
        "minFolio": "0.6.6",
        "section": "themes",
        "kind": [
          "theme"
        ],
        "permissions": [
          "home.appearance",
          "icons"
        ],
        "screens": [
          "cover",
          "inner"
        ],
        "icon": "assets/icons/theme-classic.png",
        "depiction": "depiction.json",
        "license": "MIT",
        "description": "Folio’s standard look: rounded icons, iOS badges and tinted glass.",
        "requires": {
          "features": [
            "theme"
          ]
        }
      }
    },
    {
      "id": "com.mccal.folio.theme.dark",
      "version": "1.0.0",
      "manifest": {
        "format": 1,
        "id": "com.mccal.folio.theme.dark",
        "name": "Dark theme",
        "version": "1.0.0",
        "author": {
          "name": "Folio",
          "url": "https://github.com/McCal-Codes/folio"
        },
        "minFolio": "0.6.6",
        "section": "themes",
        "kind": [
          "theme"
        ],
        "permissions": [
          "home.appearance",
          "icons"
        ],
        "screens": [
          "cover",
          "inner"
        ],
        "icon": "assets/icons/theme-dark.png",
        "depiction": "depiction.json",
        "license": "MIT",
        "description": "Dark app icons, softer badge colors and a dimmer status rail.",
        "requires": {
          "features": [
            "theme"
          ]
        }
      }
    },
    {
      "id": "com.mccal.folio.theme.tinted",
      "version": "1.0.0",
      "manifest": {
        "format": 1,
        "id": "com.mccal.folio.theme.tinted",
        "name": "Tinted theme",
        "version": "1.0.0",
        "author": {
          "name": "Folio",
          "url": "https://github.com/McCal-Codes/folio"
        },
        "minFolio": "0.6.6",
        "section": "themes",
        "kind": [
          "theme"
        ],
        "permissions": [
          "home.appearance",
          "icons"
        ],
        "screens": [
          "cover",
          "inner"
        ],
        "icon": "assets/icons/theme-tinted.png",
        "depiction": "depiction.json",
        "license": "MIT",
        "description": "Icons tinted from your wallpaper, with badges in each app’s color.",
        "requires": {
          "features": [
            "theme"
          ]
        }
      }
    },
    {
      "id": "com.mccal.folio.theme.clear",
      "version": "1.0.0",
      "manifest": {
        "format": 1,
        "id": "com.mccal.folio.theme.clear",
        "name": "Clear theme",
        "version": "1.0.0",
        "author": {
          "name": "Folio",
          "url": "https://github.com/McCal-Codes/folio"
        },
        "minFolio": "0.6.6",
        "section": "themes",
        "kind": [
          "theme"
        ],
        "permissions": [
          "home.appearance",
          "icons"
        ],
        "screens": [
          "cover",
          "inner"
        ],
        "icon": "assets/icons/theme-clear.png",
        "depiction": "depiction.json",
        "license": "MIT",
        "description": "Squircle icons, number badges, clear glass and a minimal status area without the date.",
        "requires": {
          "features": [
            "theme"
          ]
        }
      }
    }
  ]
}
